{
  "asset_manifest_sha256": "3819811e9598a65e03a2a4467672c5e836142c6fd6c3a21178b644fe0dff6953",
  "astro_binding": {
    "candidate_package_sha": "22ebe3c5e92b13684cca32c14357ef7b91834977",
    "repository_sha": "22ebe3c5e92b13684cca32c14357ef7b91834977",
    "root_selector": "[data-event-card]",
    "specimen_route": "/specimens/event-card-large-landscape-crop-safe-7906-desktop/"
  },
  "authority_mode": "astro-reference",
  "case_id": "event-card-large-landscape-crop-safe-7906-desktop",
  "component_id": "event.card",
  "conformance_profile": "pixel-strict",
  "container_width": 474,
  "contract_sha256": "45a67d195c626d9d0f643d0c56be53b9d2ffe3413a0cab3cbb1bd465b5bf31d1",
  "contract_version": "event-card-large.candidate.v1",
  "corpus_id": "ui-reference-events.v1",
  "corpus_sha256": "9ca2960fb8d723f95b19c012b50f8abb5e4503eedcf673fe178ed0f4afd46320",
  "device_scale_factor": 1,
  "event_title": "Концерт «Откровения Вены»",
  "exception_ref": null,
  "expected_candidate_deltas": [],
  "fixture_id": "event.real.7906",
  "fixture_mode": "blocking-golden",
  "fixture_sha256": "2052001842c42ac5aeaac6295cfc87a20010f6394cc16941d3386aef64579318",
  "fixture_snapshot_sha256": "5ff3be3ce417145f97b4b5c5a2d315fd820acf0ba5d222ea282523d04500adf1",
  "fixture_source": "events/event.real.7906.json",
  "penpot_binding": {
    "binding_status": "bound",
    "board_label": "Board 40.1aE · event.real.7906 · ASTRO vs PENPOT",
    "board_or_component_id": "b0fe69fd-ccaf-8025-8008-845630283a00",
    "export_sha256": "56bca4e9e0d31708ea01eb9b2eeb038a53d99890ed8ff3a6e8d3a6ad76a35115",
    "file_id": "3be9e5e1-190f-8090-8008-713c0fbe6260",
    "font_manifest_sha256": "622ccd047f4f761f45ec047734db83348d2955fb1e1b01b63fc8f6a3b0d3b160",
    "page_id": "579a886e-56e8-80a3-8008-81882dbcfb6d",
    "page_label": "Page 40.1a",
    "revision": 1253
  },
  "resolved_case_path": "cases/resolved/event-card-large-landscape-crop-safe-7906-desktop.resolved-render-case.json",
  "resolved_render_case_sha256": "e683b60d03c06e1a4d6ffde95abd9073922194a33da770e871ed4f3a9a3fc645",
  "schema_version": "ui_conformance_case_v1",
  "state_key": "viewport=desktop;layout=split-actions;presentation=dark-shell;media=loaded-visual;fixture=event.real.7906",
  "viewport_height": 900,
  "viewport_id": "desktop-1280",
  "viewport_width": 1280
}
